<?xml version="1.0" encoding="utf-8" ?>
<addressList 
    xmlns:xsi="http://www.w3.org/2001/XMLSchema-instance" 
    xsi:noNamespaceSchemaLocation="addressList-schema.xsd">
    <name>
        <firstName>Cesare</firstName>
        <surName>Tomasi</surName>
    </name>
    <address>
        <route>Via Arcoveggio 4</route>
        <postalCode>40127</postalCode>
        <province>BO</province>
        <state>Italia</state>
    </address>
    <telephoneNumber>3483401005</telephoneNumber>
    <emailAddress>cec.tomasi@gmail.com</emailAddress>
    <nationality>Italiana</nationality>
    <note>Estremamente figo</note>
</addressList>